{
  "schemaVersion": 1,
  "updatedAt": "2026-10-25",
  "logoSource": {
    "package": "simple-icons",
    "version": "16.36.0",
    "license": "CC0-1.0",
    "url": "https://simpleicons.org"
  },
  "presets": [
    {
      "id": "github",
      "revision": 1,
      "name": "GitHub",
      "category": "developer",
      "description": "Work with GitHub repositories, issues, pull requests and Actions.",
      "docsUrl": "https://github.com/github/github-mcp-server/blob/main/docs/remote-server.md",
      "logo": {
        "slug": "github",
        "title": "GitHub",
        "hex": "#181717",
        "viewBox": "0 0 24 24",
        "path": "M12 .297c-6.63 0-12 5.373-12 12 0 5.303 3.438 9.8 8.205 11.385.6.113.82-.258.82-.577 0-.285-.01-1.04-.015-2.04-3.338.724-4.042-1.61-4.042-1.61C4.422 18.07 3.633 17.7 3.633 17.7c-1.087-.744.084-.729.084-.729 1.205.084 1.838 1.236 1.838 1.236 1.07 1.835 2.809 1.305 3.495.998.108-.776.417-1.305.76-1.605-2.665-.3-5.466-1.332-5.466-5.93 0-1.31.465-2.38 1.235-3.22-.135-.303-.54-1.523.105-3.176 0 0 1.005-.322 3.3 1.23.96-.267 1.98-.399 3-.405 1.02.006 2.04.138 3 .405 2.28-1.552 3.285-1.23 3.285-1.23.645 1.653.24 2.873.12 3.176.765.84 1.23 1.91 1.23 3.22 0 4.61-2.805 5.625-5.475 5.92.42.36.81 1.096.81 2.22 0 1.606-.015 2.896-.015 3.286 0 .315.21.69.825.57C20.565 22.092 24 17.592 24 12.297c0-6.627-5.373-12-12-12"
      },
      "server": {
        "transport": "http",
        "url": "https://api.githubcopilot.com/mcp/",
        "headers": {},
        "auth": {
          "kind": "bearer",
          "token": {
            "input": "token"
          },
          "tokenHelpUrl": "https://github.com/settings/personal-access-tokens/new",
          "scopes": [
            "repo",
            "read:org",
            "read:packages"
          ]
        }
      },
      "inputs": [
        {
          "name": "token",
          "label": "Personal access token",
          "secret": true,
          "required": true,
          "help": "A fine-grained token limited to the repositories agents should reach, or a classic token with repo, read:org and read:packages.",
          "helpUrl": "https://github.com/settings/personal-access-tokens/new",
          "placeholder": "github_pat_..."
        }
      ],
      "toolPolicyDefaults": {
        "delete_*": "ask",
        "merge_*": "ask",
        "push_files": "ask"
      },
      "verified": {
        "date": "2026-10-25",
        "status": "verified",
        "checks": [
          "POST server/discover with MCP-Protocol-Version 2026-07-28 and Mcp-Method headers",
          "POST initialize with protocolVersion 2025-11-25",
          "Followed WWW-Authenticate resource_metadata to the protected-resource metadata (RFC 9728)",
          "Fetched the authorization server metadata (RFC 8414)",
          "Confirmed the toolPolicyDefaults tool names in the vendor's docs or source"
        ],
        "mcp": {
          "discover": {
            "status": 401
          },
          "initialize": {
            "status": 401
          },
          "eras": []
        },
        "oauth": {
          "wwwAuthenticateResourceMetadata": true,
          "resourceMetadataUrl": "https://api.githubcopilot.com/.well-known/oauth-protected-resource/mcp/",
          "authorizationServers": [
            "https://github.com/login/oauth"
          ],
          "authorizationServerMetadataUrl": "https://github.com/.well-known/oauth-authorization-server/login/oauth",
          "clientIdMetadataDocumentSupported": false,
          "registrationEndpoint": null,
          "codeChallengeMethodsSupported": [
            "S256"
          ]
        },
        "toolNamesSource": "https://raw.githubusercontent.com/github/github-mcp-server/main/README.md (Tools section)",
        "registryName": "io.github.github/github-mcp-server",
        "notes": [
          "github.com/login/oauth advertises neither a client ID metadata document nor a registration endpoint, so sign-in uses a personal access token (contract D19).",
          "Read-only variant: https://api.githubcopilot.com/mcp/readonly (same 401 and discovery chain), or the X-MCP-Readonly: true header."
        ]
      }
    },
    {
      "id": "gitlab",
      "revision": 1,
      "name": "GitLab",
      "category": "developer",
      "description": "Search and update GitLab projects, merge requests, work items and pipelines.",
      "setupNote": "On GitLab.com, the MCP server must be allowed for your top-level group first.",
      "docsUrl": "https://docs.gitlab.com/user/model_context_protocol/mcp_server/",
      "logo": {
        "slug": "gitlab",
        "title": "GitLab",
        "hex": "#FC6D26",
        "viewBox": "0 0 24 24",
        "path": "m23.6004 9.5927-.0337-.0862L20.3.9814a.851.851 0 0 0-.3362-.405.8748.8748 0 0 0-.9997.0539.8748.8748 0 0 0-.29.4399l-2.2055 6.748H7.5375l-2.2057-6.748a.8573.8573 0 0 0-.29-.4412.8748.8748 0 0 0-.9997-.0537.8585.8585 0 0 0-.3362.4049L.4332 9.5015l-.0325.0862a6.0657 6.0657 0 0 0 2.0119 7.0105l.0113.0087.03.0213 4.976 3.7264 2.462 1.8633 1.4995 1.1321a1.0085 1.0085 0 0 0 1.2197 0l1.4995-1.1321 2.4619-1.8633 5.006-3.7489.0125-.01a6.0682 6.0682 0 0 0 2.0094-7.003z"
      },
      "server": {
        "transport": "http",
        "url": "https://gitlab.com/api/v4/mcp",
        "headers": {},
        "auth": {
          "kind": "oauth",
          "registration": "auto",
          "advertised": {
            "cimd": false,
            "dcr": true
          },
          "scopes": [
            "mcp"
          ]
        }
      },
      "inputs": [],
      "toolPolicyDefaults": {
        "accept_merge_request": "ask",
        "manage_pipeline": "ask"
      },
      "verified": {
        "date": "2026-10-25",
        "status": "verified",
        "checks": [
          "POST server/discover with MCP-Protocol-Version 2026-07-28 and Mcp-Method headers",
          "POST initialize with protocolVersion 2025-11-25",
          "Followed WWW-Authenticate resource_metadata to the protected-resource metadata (RFC 9728)",
          "Fetched the authorization server metadata (RFC 8414)",
          "Confirmed the toolPolicyDefaults tool names in the vendor's docs or source"
        ],
        "mcp": {
          "discover": {
            "status": 401
          },
          "initialize": {
            "status": 401
          },
          "eras": []
        },
        "oauth": {
          "wwwAuthenticateResourceMetadata": true,
          "resourceMetadataUrl": "https://gitlab.com/.well-known/oauth-protected-resource/api/v4/mcp",
          "authorizationServers": [
            "https://gitlab.com"
          ],
          "authorizationServerMetadataUrl": "https://gitlab.com/.well-known/oauth-authorization-server",
          "clientIdMetadataDocumentSupported": false,
          "registrationEndpoint": "https://gitlab.com/oauth/register",
          "codeChallengeMethodsSupported": [
            "plain",
            "S256"
          ]
        },
        "toolNamesSource": "https://docs.gitlab.com/user/model_context_protocol/mcp_server_tools/",
        "registryName": "com.gitlab/mcp",
        "notes": [
          "WWW-Authenticate names scope=\"mcp\". The authorization server advertises plain and S256 PKCE; atrium requires S256.",
          "GitLab documents a dynamic registration limit of 10 per hour per IP, and admins can turn registration off."
        ]
      }
    },
    {
      "id": "sentry",
      "revision": 1,
      "name": "Sentry",
      "category": "developer",
      "description": "Look up Sentry issues, events and traces, and help triage errors.",
      "docsUrl": "https://mcp.sentry.dev/",
      "logo": {
        "slug": "sentry",
        "title": "Sentry",
        "hex": "#362D59",
        "viewBox": "0 0 24 24",
        "path": "M13.91 2.505c-.873-1.448-2.972-1.448-3.844 0L6.904 7.92a15.478 15.478 0 0 1 8.53 12.811h-2.221A13.301 13.301 0 0 0 5.784 9.814l-2.926 5.06a7.65 7.65 0 0 1 4.435 5.848H2.194a.365.365 0 0 1-.298-.534l1.413-2.402a5.16 5.16 0 0 0-1.614-.913L.296 19.275a2.182 2.182 0 0 0 .812 2.999 2.24 2.24 0 0 0 1.086.288h6.983a9.322 9.322 0 0 0-3.845-8.318l1.11-1.922a11.47 11.47 0 0 1 4.95 10.24h5.915a17.242 17.242 0 0 0-7.885-15.28l2.244-3.845a.37.37 0 0 1 .504-.13c.255.14 9.75 16.708 9.928 16.9a.365.365 0 0 1-.327.543h-2.287c.029.612.029 1.223 0 1.831h2.297a2.206 2.206 0 0 0 1.922-3.31z"
      },
      "server": {
        "transport": "http",
        "url": "https://mcp.sentry.dev/mcp",
        "headers": {},
        "auth": {
          "kind": "oauth",
          "registration": "auto",
          "advertised": {
            "cimd": true,
            "dcr": true
          }
        }
      },
      "inputs": [],
      "toolPolicyDefaults": {
        "delete_*": "ask"
      },
      "verified": {
        "date": "2026-10-25",
        "status": "verified",
        "checks": [
          "POST server/discover with MCP-Protocol-Version 2026-07-28 and Mcp-Method headers",
          "POST initialize with protocolVersion 2025-11-25",
          "Followed WWW-Authenticate resource_metadata to the protected-resource metadata (RFC 9728)",
          "Fetched the authorization server metadata (RFC 8414)",
          "Confirmed the toolPolicyDefaults tool names in the vendor's docs or source"
        ],
        "mcp": {
          "discover": {
            "status": 401
          },
          "initialize": {
            "status": 401
          },
          "eras": []
        },
        "oauth": {
          "wwwAuthenticateResourceMetadata": true,
          "resourceMetadataUrl": "https://mcp.sentry.dev/.well-known/oauth-protected-resource/mcp",
          "authorizationServers": [
            "https://mcp.sentry.dev"
          ],
          "authorizationServerMetadataUrl": "https://mcp.sentry.dev/.well-known/oauth-authorization-server",
          "clientIdMetadataDocumentSupported": true,
          "registrationEndpoint": "https://mcp.sentry.dev/oauth/register",
          "codeChallengeMethodsSupported": [